v2ProductName,count
Google Sunglasses,2734
Google Laptop and Cell Phone Stickers,1582
Google 22 oz Water Bottle,1569
Google Men's 100% Cotton Short Sleeve Hero Tee White,1534
Google Men's 100% Cotton Short Sleeve Hero Tee Black,1428
Google Men's 100% Cotton Short Sleeve Hero Tee Navy,1118
Google Men's  Zip Hoodie,942
Recycled Paper Journal Set,858
BLM Sweatshirt,814
Engraved Ceramic Google Mug,804
Google Twill Cap,800
26 oz Double Wall Insulated Bottle,786
Google Men's Vintage Badge Tee Black,762
Google Men's 100% Cotton Short Sleeve Hero Tee Red,732
Red Shine 15 oz Mug,722
Recycled Mouse Pad,692
YouTube Custom Decals,684
Maze Pen,652
Windup Android,622
Foam Can and Bottle Cooler,616
Badge Holder,612
Sport Bag,602
Leatherette Journal,598
Google Women's Short Sleeve Hero Tee White,584
Google Men's Bike Short Sleeve Tee Charcoal,564
Google Metallic Notebook Set,562
Google Kick Ball,544
Google Women's Fleece Hoodie,504
YouTube Leatherette Notebook Combo,494
Google Doodle Decal,474
YouTube Men's Short Sleeve Hero Tee Charcoal,474
Google Baby Essentials Set,454
Google Canvas Tote Natural/Navy,450
8 pc Android Sticker Sheet,448
Google 17oz Stainless Steel Sport Bottle,442
Android Rise 14 oz Mug,434
YouTube Men's Short Sleeve Hero Tee Black,431
Google Men's Short Sleeve Badge Tee Charcoal,431
YouTube Twill Cap,424
Android Sticker Sheet Ultra Removable,422
Google Men's Long Sleeve Raglan Ocean Blue,420
Google Men's Short Sleeve Hero Tee Charcoal,419
1 oz Hand Sanitizer,414
Four Color Retractable Pen,400
Collapsible Shopping Bag,388
Ballpoint Stick Pen 4 Pack,384
Keyboard DOT Sticker,366
22 oz Android Bottle,364
Google Tri-blend Hoodie Grey,364
Pen Pencil & Highlighter Set,362
Color Changing Grip Pen,362
24 oz YouTube Sergeant Stripe Bottle,360
7&quot; Dog Frisbee,360
YouTube Men's Fleece Hoodie Black,344
20 oz Stainless Steel Insulated Tumbler,344
Galaxy Screen Cleaning Cloth,336
Colored Pencil Set,336
Spiral Notebook and Pen Set,328
Rubber Grip Ballpoint Pen 4 Pack,322
Google Women's Short Sleeve Hero Tee Red Heather,322
Electronics Accessory Pouch,314
Gift Card - $25.00,312
Google Device Stand,312
Ballpoint Pen Blue,310
Google Women's Vintage Hero Tee Black,308
Google Men's Short Sleeve Performance Badge Tee Black,298
Google Men's Vintage Badge Tee White,298
Ballpoint LED Light Pen,298
Red Spiral Google Notebook,290
Google Men's Short Sleeve Hero Tee Heather,289
YouTube Youth Short Sleeve Tee Red,288
Google Men's Vintage Badge Tee Sage,286
Reusable Shopping Bag,284
Google Men's Watershed Full Zip Hoodie Grey,282
Google Stylus Pen w/ LED Light,274
Google Men's Quilted Insulated Vest Black,274
Google Women's Short Sleeve Hero Tee Black,268
Waterproof Backpack,266
Crunch Noise Dog Toy,258
Google Rucksack,250
Google Women's Vintage Hero Tee White,250
Google Men's Pullover Hoodie Grey,248
Google Ballpoint Pen Black,242
Google Women's Vintage Hero Tee Lavender,238
SPF-15 Slim & Slender Lip Balm,234
Google Men's Vintage Tank,232
Google Womens 3/4 Sleeve Baseball Raglan Heather/Black,232
Google Collapsible Pet Bowl,230
Rocket Flashlight,228
Android BTTF Moonshot Graphic Tee,226
Google Men's Lightweight Microfleece Jacket Black,224
Google Water Resistant Bluetooth Speaker,224
22 oz YouTube Bottle Infuser,222
Google Hard Cover Journal,220
Compact Selfie Stick,220
Google Car Clip Phone Holder,220
Google Lunch Bag,216
Google Women's Short Sleeve Hero Tee Sky Blue,214
Google Men's Short Sleeve Performance Badge Tee Pewter,208
23 oz Wide Mouth Sport Bottle,204
Bottle Opener Clip,202
Android BTTF Cosmos Graphic Tee,202
Google Women's Scoop Neck Tee Black,202
Google Laptop Backpack,200
Google Blackout Cap,198
Google Alpine Style Backpack,198
Google Men's Skater Tee Grey,198
Switch Tone Color Crayon Pen,196
Google Men's Short Sleeve Performance Badge Tee Navy,196
YouTube Women's Fleece Hoodie Black,188
Google Vintage Henley Grey/Black,188
Google Onesie Green,188
Google Men's Performance Full Zip Jacket Black,186
Google Luggage Tag,184
Google Trucker Hat,184
Google Men's Quilted Insulated Vest Battleship Grey,182
Rainbow Stylus Pen,180
Google Tube Power Bank,180
Google Women's Lightweight Microfleece Jacket,180
Metal Earbuds with Small Zipper Case,176
Google Insulated Stainless Steel Bottle,174
Android 17oz Stainless Steel Sport Bottle,172
YouTube Onesie Heather,172
Google Spiral Journal with Pen,168
Google Power Bank,164
YouTube Men's Short Sleeve Hero Tee White,164
Google Infant Zip Hood Royal Blue,164
Android Men's Short Sleeve Hero Tee Heather,162
Android Men's  Zip Hoodie,160
Android Men's Short Sleeve Tri-blend Hero Tee Grey,158
Men's Softshell Jacket Black/Grey,158
Google Infant Zip Hood Pink,156
Google Men's Skater Tee Charcoal,154
Insulated Bottle,154
Google Men's Bayside Graphic Tee,152
Android 24 oz Contigo Bottle,152
Retractable Ballpoint Pen Red,150
Waze Mobile Phone Vent Mount,150
Google Zipper-front Sports Bag,150
Google Heavyweight Long Sleeve Hero Tee Navy,150
Gel Roller Pen,148
Android Women's Long Sleeve Blended Cardigan Grey,148
Google Wool Heather Cap Heather/Navy,146
Google Women's Quilted Insulated Vest Black,146
Men's Weatherblock Shell Jacket Black,146
Google Youth Baseball Raglan Heather/Black,146
Google Men's Long & Lean Tee Charcoal,140
Google Toddler Short Sleeve Tee White,138
Android Toddler Short Sleeve T-shirt Pink,138
Android Journal Book Set,136
Google Slim Utility Travel Bag,136
Google Women's Long Sleeve Tee Lavender,136
Google Tote Bag,136
Google Bluetooth Headphones,134
Google Youth Girl Hoodie,134
Ballpoint Pen & Matching Tube Case,134
Google Heavyweight Long Sleeve Hero Tee Burgundy,132
YouTube Men's Vintage Tank,132
YouTube Men's Vintage Tee,130
Google Women's Scoop Neck Tee White,130
Android Men's Pep Rally Short Sleeve Tee Navy,128
YouTube Trucker Hat,126
Google Men's Performance Hero Tee Gunmetal,126
Google Youth Short Sleeve Tee White,126
Google Women's Short Sleeve Hero Tee Grey,124
Google Toddler Hoodie Royal Blue,122
Google Women's Tee Grey,120
Google Onesie Red,120
You Tube Toddler Short Sleeve Tee Red,120
Suitcase Organizer Cubes,120
Android Onesie Gold,118
Google Men's Airflow 1/4 Zip Pullover Black,118
Google RFID Journal,118
Google Toddler Short Sleeve T-shirt Grey,118
Google Onesie Royal Blue,118
Google Snapback Hat Black,116
Google Women's Short Sleeve Badge Tee Navy,116
Google Youth Short Sleeve T-shirt Royal Blue,114
Google 25 oz Red Stainless Steel Bottle,114
Google Toddler Raglan Shirt Blue Heather/Navy,114
24 oz USA Made Aluminum Bottle,114
Android Glass Water Bottle with Black Sleeve,114
Google Long Sleeve Raglan Badge Henley Ocean Blue,114
Google 17 oz Double Wall Stainless Steel Insulated Bottle,112
Android Toddler Short Sleeve T-shirt Pewter,112
Android Men's Long Sleeve Badge Crew Tee Heather,112
Google Toddler Short Sleeve T-shirt Royal Blue,110
Google Men's Vintage Badge Tee Green,110
Executive Twist Ballpoint Pen,110
Google Youth Short Sleeve T-shirt Green,110
Android Men's Take Charge Short Sleeve Tee Purple,110
22 oz Mini Mountain Bottle,110
Women's Performance Full Zip Jacket Black,108
YouTube Men's Vintage Henley,108
Seat Pack Organizer,106
Google Men's Long Sleeve Pullover Badge Tee Heather,106
Google Men's Performance 1/4 Zip Pullover Heather/Black,104
Gift Card - $50.00,102
Google Pet Feeding Mat,102
25L Classic Rucksack,100
Google 3/4 Sleeve Raglan Badge Henley Black,98
YouTube Hard Cover Journal,98
Leather and Metal Ballpoint Pen,96
Google Infuser-Top Water Bottle,96
Google Men's Around The Block Short Sleeve Tee Ash,96
Google Collapsible Duffel Black,94
Google Men's Short Sleeve Performance Badge Tee Charcoal,94
YouTube Women's Short Sleeve Hero Tee Charcoal,94
YouTube Notebook and Pen Set,94
Waze Mood Original Window Decal,94
Google Laptop Tech Backpack,94
Google Youth Girl Tee Green,92
Google 5-Panel Snapback Cap,92
YouTube Spiral Journal with Pen,92
Android Men's Short Sleeve Hero Tee White,92
Google Executive Umbrella,90
Android Twill Cap,90
Gunmetal Roller Ball Pen,90
Google Pocket Bluetooth Speaker,90
Android Youth Short Sleeve T-shirt Pewter,88
Android Men's Vintage Tank,88
Google Onesie Red/Graphite,88
Android Men's Engineer Short Sleeve Tee Charcoal,88
Google Women's Hero V-Neck Tee White,88
Android Wool Heather Cap Heather/Black,86
Android Lifted Men's Short Sleeve Tee Blue,86
Google Infant Short Sleeve Tee White,86
Ballpoint Stylus Pen,86
Android Men's Outerstellar Short Sleeve Tee Black,84
Waterproof Gear Bag,84
Google Women's 1/4 Zip Performance Pullover Two-Tone Blue,84
Google 25 oz Blue Stainless Steel Bottle,84
Google Leather Journal-Brown,84
Google Women's Convertible Vest-Jacket Black,84
Google Men's Short Sleeve Hero Tee Light Blue,84
Softsided Travel Pouch Set,84
Google Leather Journal-Black,84
Google Women's Yoga Jacket Black,84
Google Women's V-Neck Tee Charcoal,84
Metal Texture Roller Pen,82
Android Men's Vintage Henley,82
Micro Wireless Earbud,82
Android Youth Short Sleeve T-shirt Aqua,82
Google Men's Pullover Hoodie,82
Google Youth Short Sleeve Tee Red,82
YouTube Women's Short Sleeve Tri-blend Badge Tee Charcoal,80
Google Toddler Short Sleeve Tee Red,80
Large Zipper Top Tote Bag,78
Google 25 oz Clear Stainless Steel Bottle,78
Google Leather Perforated Journal,78
Android Toddler Short Sleeve T-shirt Aqua,78
Google Youth Short Sleeve T-shirt Yellow,78
Basecamp Explorer Powerbank Flashlight,78
Waze Mood Ninja Window Decal,78
Google Women's Short Sleeve V-Neck Tee Lavender,78
Google Women's 1/4 Zip Performance Pullover Black,76
Google Women's Short Sleeve Performance Tee Navy,76
Google Women's Long Sleeve Blended Cardigan Charcoal,76
Google 2200mAh Micro Charger,76
Google Women's Vintage T-Shirt Black,76
Google 5-Panel Cap,74
Google Men's Microfiber 1/4 Zip Pullover Grey/Black,74
Grip Highlighter Pen 3 Pack,74
YouTube Men's Long Sleeve Pullover Badge Tee Heather,74
Compact Bluetooth Speaker,74
Compact Journal with Recycled Pages,70
Google G Noise-reducing Bluetooth Headphones,70
Google Stretch Fit Hat M/L Navy,70
Google Women's Vintage Hero Tee Platinum,68
Android Women's Fleece Hoodie,68
Waze Baby on Board Window Decal,68
Yoga Mat Blue,68
Crunch-It Dog Toy,68
Google Men's Microfiber 1/4 Zip Pullover Blue/Indigo,66
Google 40 oz Insulated Monster Bottle,66
Google Youth Sports Tee Navy,66
Google Men's Airflow 1/4 Zip Pullover Lapis,66
Straw Beach Mat,66
Google Men's Performance Polo Grey/Black,64
"Google High Capacity 10,400mAh Charger",64
Google Women's Short Sleeve Hero Tee Heather,64
Google Women's 1/4 Zip Jacket Charcoal,64
Satin Black Ballpoint Pen,64
YouTube Wool Heather Cap Heather/Black,64
Google Accent Insulated Stainless Steel Bottle,64
Google Women's Short Sleeve V-Neck Tee Black,64
Google Women's Short Sleeve Shirt Blue,64
YouTube Womens 3/4 Sleeve Baseball Raglan White/Black,62
Google Men's Heavyweight Long Sleeve Hero Tee Navy,60
Android Men's Long & Lean Badge Tee Charcoal,60
Android Men's Vintage Tee,60
Plastic Sliding Flashlight,58
Android Men's Paradise Short Sleeve Tee Olive,58
Google Collapsible Duffel Blue,58
YouTube Men's Skater Tee Charcoal,58
Google Women's Short Sleeve Badge Tee Grey,58
Aluminum Handy Emergency Flashlight,56
Android Stretch Fit Hat M/L,56
Waze Dress Socks,56
Google Device Holder Sticky Pad,54
Google Women's Convertible Vest-Jacket Sea Foam Green,54
Google Women's Quilted Insulated Vest White,54
Gift Card- $100.00,52
Google Women's Scoop Neck Tee Green,52
Google Toddler Short Sleeve T-shirt Green,52
Google Women's Short Sleeve Performance Tee Black,52
Google Toddler Short Sleeve T-shirt Yellow,50
Google 4400mAh Power Bank,50
Waze Men's Short Sleeve Tee,50
Google Men's 3/4 Sleeve Raglan Henley Grey,50
YouTube Luggage Tag,50
Google Toddler 1/4 Zip Fleece Pewter,48
Android Men's Skater Badge Tee Charcoal,46
Fashion Sunglasses & Pouch,46
Google Infant Short Sleeve Tee Red,46
Google Women's Short Sleeve Badge Tee Red Heather,46
Women's Weatherblock Shell Jacket Black,46
Blue Metallic Textured Spiral Notebook Set,46
Google Men's Convertible Vest-Jacket Pewter,44
Google Women's Short Sleeve Performance Tee Charcoal,44
Android Onesie Sprout Green,44
Android Lunch Kit,42
Google Men's Long Sleeve Raglan Cranberry,42
Android Baby Esssentials Set,42
16 oz. Hot and Cold Tumbler,42
Google Bluetooth Speaker-Power Bank,42
Android Heavyweight Long Sleeve Badge Tee Black,40
Android Onesie Baby Blue,40
YouTube RFID Journal,40
Google Spiral Leather Journal,40
Waze Mood Happy Window Decal,40
Android Men's 3/4 Sleeve Raglan Henley Black,40
Koozie Can Kooler,40
Google Bongo Cupholder Bluetooth Speaker,38
Android Luggage Tag,38
Google Men's Long & Lean Tee Grey,38
Google Women's Yoga Pants,38
Google Stretch Fit Hat L/XL Navy,38
Android BTTF Moonshot Shirt,38
Yoga Block,36
Android Infant Short Sleeve Tee Pewter,36
YouTube Women's Short Sleeve Tri-blend Badge Tee Grey,36
Google Stretch Fit Hat S/M Navy,36
Google Women's V-Neck Tee Grey,36
Micro Wireless Earbuds,36
Google Adult Tee Fruit Games Pineapple,36
Android Spiral Journal with Pen,34
Google Women's Short Sleeve Shirt Dark Grey,34
Android Infant Short Sleeve Tee Pink,34
Clip-on Compact Charger,34
Google Men's Colorblock Tee White/Heather,32
YouTube Infant Short Sleeve Tee Red,32
Stadium Cups-Sets of 4,32
Google Infant Short Sleeve Tee Cornflower Blue,30
Android Stretch Fit Hat L/XL,30
Android BTTF Cosmos Shirt,30
Google  Women's Muscle Tee,30
Google Flashlight,28
Women's YouTube Short Sleeve Hero Tee Black,28
Aria Bluetooth Speaker,28
Google Women's Short Sleeve Performance Tee Pewter,26
Google Toddler Sports T-shirt Red,26
4-in-1 Carabiner Charger,26
Google Women's Short Sleeve Shirt Red,26
Google Women's Insulated Thermal Vest Navy,24
Eco-Aware Recycled Journal Combo,24
YouTube Women's Short Sleeve Crew Tee,24
Android RFID Journal,22
Yoga Mat Purple,22
Android Stretch Fit Hat S/M,22
Android Stretch Fit Hat,22
Latitudes Foldaway Shopper,22
PaperMate Ink Joy Retractable Pen,22
Google Women's Performance Hero Tee Gunmetal,20
Google French Terry Cap,20
Waze Men's Typography Short Sleeve Tee,20
Google Women's Zip Hoodie Grey,20
Chevron Shopper,20
Google Women's Performance Golf Polo Blue,20
YouTube Men's 3/4 Sleeve Henley,20
Quatro Retractable Pen,20
Android 25 oz Green Apple Stainless Steel Bottle,18
Google Men's Heavyweight Long Sleeve Hero Tee Burgundy,18
Waze Pack of 9 Decal Set,18
YouTube Men's Long & Lean Tee Charcoal,18
Android Infant Short Sleeve Tee Aqua,18
YouTube Sticker Sheet,18
Android Women's Short Sleeve Badge Tee Dark Heather,18
Android Women's Short Sleeve Tri-blend Badge Tee Light Blue,18
Pop-a-Point Crayon,18
Google Bib White,18
Google Adult Tee Fruit Games Dragonfruit,18
Blue Keeper Notebook Set with Flap,18
Android Women's Racer Back Tank Black,16
Google Men's Performance Badge Tee Black,16
Digital Lightshow Smart Speaker and Notification Center,16
Android Women's Short Sleeve Hero Tee Black,16
Google PowerKit,16
Mistral Rucksack,16
Kick Ball,16
16 oz. Hot/Cold Tumbler,16
Google Men's Long Sleeve Pullover Crew Tee Heather,16
Google Toddler Tee Fruit Games Pineapple,14
Google 3/4 Sleeve Raglan Henley Grey,14
Google Women's Shell Jacket Blue/Black,14
YouTube Women's Racer Back Tank Black,14
Android Hard Cover Journal,14
Google Bib Red,14
Google Women's Short Sleeve V-Neck Tee Dark Grey,14
UpCycled Handlebar Bag,12
UpCycled Bike Saddle Bag,12
Google Women's Performance Polo Grey/Black,12
PaperMate Ink Joy RT Pen,12
Google Canvas Tote Fruit Games Lemon,12
Google Toddler Tee Fruit Games Strawberry,12
Compact Eco Journal,12
Oasis Backpack,12
Waterpoof Gear Bag,12
Google Women's Softshell Jacket Black/Grey,10
Google Men's Performance Tee Gunmetal,10
Google Infant Short Sleeve Tee Royal Blue,10
SPF-15 Lip Balm,10
YouTube 24 oz Stripe Accent Bottle,10
Google Men's Zip Hoodie,10
Google Phone Sanitizer,10
Google Sunglasses Red,10
Google Engraved Ceramic Mug,10
Google Youth Tee Fruit Games Cherries,10
YouTube Women's S/S Crew Tee,10
Bic Intensity Clic Gel Pen,10
Google Women's Tee Purple,10
UFO Bluetooth Water Resistant Speaker,10
Google Women's Colorblock Tee White,8
Eco-Aware Large Recycled Journal Combo,8
Grip Kit Cable Organizer,8
Google Sunglasses Blue,8
Google Youth Tee Fruit Games Banana,8
Collapsible Pet Bowl,8
PaperMate Ink Joy Pen,8
Android 24 oz Contigo Addison,8
Google Women's Short Sleeve V-Neck Tee Stone,8
Bic Digital Clic Stic Stylus Pen,8
Google Youth Tee Fruit Games Pineapple,8
Gift Card - $250.00,8
Waze Women's Short Sleeve Tee,6
Waze Women's Typography Short Sleeve Tee,6
Android Women's Short Sleeve Badge Tee Light Charcoal,6
Google Women's Badge Performance Tee Black,6
YouTube Men's Short Sleeve Hero Tee  White,6
Speed Zone Air Mesh Tote,6
Google Adult Tee Fruit Games Cherries,6
Google Youth Tee Fruit Games Lemon,6
Google Youth Tee Fruit Games Strawberry,6
PowerClip Lightning Charger,6
Google Sports Bag,6
Google Men's Performance Badge Tee Navy,4
Google Women's Short Sleeve Hero Dark Grey,4
YouTube Notebook Set,4
Android 14 oz Mug White/Green,4
Google Sunglasses Yellow,4
Google Toddler Tee Fruit Games Cherries,4
Google Toddler Tee Fruit Games Lemon,4
Google Women's Performance Tee Gunmetal,4
Google Men's Long Sleeve Baseball Raglan Cranberry,4
Google Women's Quilted Insulated Vest Pewter,4
8pc Android Sticker Sheet,4
Google Toddler Tee Fruit Games Banana,4
ATOM Wireless Earbud Headset,4
Set of 3 Packing Cubes,4
Deluge Waterproof Backpack,4
Google Women's Tank Top,4
Android Men's Zip Hoodie,2
Android Men's Heavyweight Long Sleeve Badge Tee Black,2
Google Collapsible Pet Bowl Blue,2
Google Leather Journal (Black),2
Google Red Spiral Notebook,2
Google Sunglasses Green,2
Powerbank Flashlight,2
Solo Pro Backpack,2
Pet Feeding Mat,2
Android 5-Panel Low Cap,2
Google Women's Short Sleeve Shirt Light Grey,2
Google Women's Badge Performance Tee Gunmetal,2
25 oz. Infusion Water Bottle,2
Google Badge Pull,2
Google Men's Performance Badge Tee Gunmetal,2
Android Women's Short Sleeve Tri-blend Badge Tee Light Grey,2
Carabiner Flashlight,2
Google Women's Recycled Fabric Tee,2
Screen Cleaning Cloth,2
